{
  "$schema": "https://squadboard.dev/schemas/squadapp/v1/squadapp.json",
  "schemaVersion": 1,
  "appId": "support-ticket-router",
  "version": "1.0.0",
  "name": "Support Ticket Router",
  "displayName": "Support Ticket Router",
  "description": "A Squad sample that reads real support ticket files from a folder and triages them with a four-agent AI squad — classifying priority, matching known issues, drafting responses, and producing a prioritized action queue.",
  "kind": "squadboard-app",
  "author": "Squad IRL",
  "license": "MIT",
  "homepage": "https://github.com/bradygaster/Squad-IRL/tree/main/support-ticket-router",
  "tags": [
    "support",
    "routing",
    "customer-service",
    "multi-agent"
  ],
  "requires": {
    "squadboard": ">=0.1.0"
  }
}